{
  "$schema": "./model-assets.schema.json",
  "schema_version": 1,
  "bundle_id": "debug-platform-retrieval-gguf-win-x64-cpu-v1",
  "bundle_status": "experimental_unverified",
  "target": {
    "os": "windows",
    "architecture": "x86_64",
    "backend": "cpu"
  },
  "runtime": {
    "id": "llama.cpp",
    "repository": "https://github.com/ggml-org/llama.cpp.git",
    "tag": "b10729",
    "revision": "458681e1d5d4a29a1463c4732e03226cf384b997",
    "license": {
      "spdx": "MIT",
      "source_url": "https://github.com/ggml-org/llama.cpp/blob/458681e1d5d4a29a1463c4732e03226cf384b997/LICENSE",
      "notice_required": true
    },
    "windows_archive": {
      "url": "https://github.com/ggml-org/llama.cpp/releases/download/b10729/llama-b10729-bin-win-cpu-x64.zip",
      "relative_path": "downloads/llama-b10729-bin-win-cpu-x64.zip",
      "size_bytes": 18367763,
      "sha256": "628ad9516f13c1b01727657987abdf57c019f58af074e6f3e5ec36996188f6cd"
    },
    "archive_include": [
      "llama-server.exe",
      "*.dll",
      "LICENSE-LLVM-OpenMP"
    ]
  },
  "native_dependencies": [
    {
      "id": "microsoft-vc143-crt-x64-app-local",
      "version": "14.44.35211.0",
      "source_package": {
        "url": "https://download.visualstudio.microsoft.com/download/pr/45d3b8dd-bced-4b37-9974-142f748d710c/4aaf54db0bfc9435f7c3660e1a00237a4b556042bfeea64bde44c2e0194e6ee5/Microsoft.VC.14.44.17.14.CRT.Redist.X64.base.vsix",
        "relative_path": "downloads/Microsoft.VC.14.44.17.14.CRT.Redist.X64.base.vsix",
        "size_bytes": 3224191,
        "sha256": "4aaf54db0bfc9435f7c3660e1a00237a4b556042bfeea64bde44c2e0194e6ee5"
      },
      "license": {
        "id": "LicenseRef-Microsoft-Visual-Studio-2022-Redistributable",
        "source_url": "https://learn.microsoft.com/en-us/visualstudio/releases/2022/redistribution",
        "redistribution": "app_local_unmodified",
        "notice_required": true
      },
      "signer_subject_contains": "Microsoft Windows Software Compatibility Publisher",
      "files": [
        {
          "archive_path": "Contents/VC/Redist/MSVC/14.44.35112/x64/Microsoft.VC143.CRT/concrt140.dll",
          "cache_path": "llama/concrt140.dll",
          "install_path": "runtime/llama/concrt140.dll",
          "size_bytes": 324208,
          "sha256": "2405355f0a58067b258f8df33c327e3a3d716eaac5a3a5aebb757842d85bd376"
        },
        {
          "archive_path": "Contents/VC/Redist/MSVC/14.44.35112/x64/Microsoft.VC143.CRT/msvcp140.dll",
          "cache_path": "llama/msvcp140.dll",
          "install_path": "runtime/llama/msvcp140.dll",
          "size_bytes": 557728,
          "sha256": "0f885b509a685d2bbfa652fed26b5fb31d88fbdab0a978c641d1c7b8aa460aa9"
        },
        {
          "archive_path": "Contents/VC/Redist/MSVC/14.44.35112/x64/Microsoft.VC143.CRT/msvcp140_1.dll",
          "cache_path": "llama/msvcp140_1.dll",
          "install_path": "runtime/llama/msvcp140_1.dll",
          "size_bytes": 35952,
          "sha256": "bfad5aef4c63a669e3c140655cdfdf395b6c979b400a447bd5dcb65ed8826c3d"
        },
        {
          "archive_path": "Contents/VC/Redist/MSVC/14.44.35112/x64/Microsoft.VC143.CRT/msvcp140_2.dll",
          "cache_path": "llama/msvcp140_2.dll",
          "install_path": "runtime/llama/msvcp140_2.dll",
          "size_bytes": 280200,
          "sha256": "3ea06f0ee098b4823cb79599df3780e7f23cce52c19aac31d2a0d47efe33a5e9"
        },
        {
          "archive_path": "Contents/VC/Redist/MSVC/14.44.35112/x64/Microsoft.VC143.CRT/msvcp140_atomic_wait.dll",
          "cache_path": "llama/msvcp140_atomic_wait.dll",
          "install_path": "runtime/llama/msvcp140_atomic_wait.dll",
          "size_bytes": 50304,
          "sha256": "640b2aefced484d0368eea5bdd06addd0658a3a70a49256e560d6923b404a479"
        },
        {
          "archive_path": "Contents/VC/Redist/MSVC/14.44.35112/x64/Microsoft.VC143.CRT/msvcp140_codecvt_ids.dll",
          "cache_path": "llama/msvcp140_codecvt_ids.dll",
          "install_path": "runtime/llama/msvcp140_codecvt_ids.dll",
          "size_bytes": 31872,
          "sha256": "f2069a52880ec885ee7f0511186100eb7fada0411a2b4948fafea7735b878a18"
        },
        {
          "archive_path": "Contents/VC/Redist/MSVC/14.44.35112/x64/Microsoft.VC143.CRT/vccorlib140.dll",
          "cache_path": "llama/vccorlib140.dll",
          "install_path": "runtime/llama/vccorlib140.dll",
          "size_bytes": 352384,
          "sha256": "19839407c3fdbc824e5bce189bf68ddf8097f12ec28b757797ffa0415c144ddd"
        },
        {
          "archive_path": "Contents/VC/Redist/MSVC/14.44.35112/x64/Microsoft.VC143.CRT/vcruntime140.dll",
          "cache_path": "llama/vcruntime140.dll",
          "install_path": "runtime/llama/vcruntime140.dll",
          "size_bytes": 124544,
          "sha256": "d5e4d9a3e835fa679450145d6a7d94e36573a509317111904d9b3712c30d9066"
        },
        {
          "archive_path": "Contents/VC/Redist/MSVC/14.44.35112/x64/Microsoft.VC143.CRT/vcruntime140_1.dll",
          "cache_path": "llama/vcruntime140_1.dll",
          "install_path": "runtime/llama/vcruntime140_1.dll",
          "size_bytes": 49792,
          "sha256": "1f2d41c4aa5db0bc33ebf7b66d72943a817d7ce6cbe880502a9403823633093f"
        },
        {
          "archive_path": "Contents/VC/Redist/MSVC/14.44.35112/x64/Microsoft.VC143.CRT/vcruntime140_threads.dll",
          "cache_path": "llama/vcruntime140_threads.dll",
          "install_path": "runtime/llama/vcruntime140_threads.dll",
          "size_bytes": 38528,
          "sha256": "219915cf20822f34d5e7c1fdd4e21ae7f3396881096c51036225fb8f84b47afa"
        }
      ]
    }
  ],
  "models": [
    {
      "id": "BAAI/bge-base-zh-v1.5",
      "task_type": "embedding",
      "upstream": {
        "repository": "https://huggingface.co/BAAI/bge-base-zh-v1.5",
        "revision": "f03589ceff5aac7111bd60cfc7d497ca17ecac65",
        "license": {
          "spdx": "MIT",
          "source_url": "https://huggingface.co/BAAI/bge-base-zh-v1.5/tree/f03589ceff5aac7111bd60cfc7d497ca17ecac65",
          "notice_required": true
        }
      },
      "distribution": "build_from_source",
      "source_files": [
        {
          "url": "https://huggingface.co/BAAI/bge-base-zh-v1.5/resolve/f03589ceff5aac7111bd60cfc7d497ca17ecac65/1_Pooling/config.json",
          "relative_path": "sources/bge-base-zh-v1.5/1_Pooling/config.json",
          "size_bytes": 190,
          "sha256": "c9bef85e8bbf4b2eab4941b3fb62bd33f88686748b478f2e264d256472d9643b"
        },
        {
          "url": "https://huggingface.co/BAAI/bge-base-zh-v1.5/resolve/f03589ceff5aac7111bd60cfc7d497ca17ecac65/config.json",
          "relative_path": "sources/bge-base-zh-v1.5/config.json",
          "size_bytes": 998,
          "sha256": "6675c035d945dffc89f77a04a254b87cc193a9185a098bb505fe4963b6ddbac1"
        },
        {
          "url": "https://huggingface.co/BAAI/bge-base-zh-v1.5/resolve/f03589ceff5aac7111bd60cfc7d497ca17ecac65/config_sentence_transformers.json",
          "relative_path": "sources/bge-base-zh-v1.5/config_sentence_transformers.json",
          "size_bytes": 124,
          "sha256": "940d5f50db195fa6e5e6a4f122c095f77880de259d74b14a65779ed48bdd7c56"
        },
        {
          "url": "https://huggingface.co/BAAI/bge-base-zh-v1.5/resolve/f03589ceff5aac7111bd60cfc7d497ca17ecac65/modules.json",
          "relative_path": "sources/bge-base-zh-v1.5/modules.json",
          "size_bytes": 349,
          "sha256": "84e40c8e006c9b1d6c122e02cba9b02458120b5fb0c87b746c41e0207cf642cf"
        },
        {
          "url": "https://huggingface.co/BAAI/bge-base-zh-v1.5/resolve/f03589ceff5aac7111bd60cfc7d497ca17ecac65/pytorch_model.bin",
          "relative_path": "sources/bge-base-zh-v1.5/pytorch_model.bin",
          "size_bytes": 409138989,
          "sha256": "731cf5d88ed555a21ff2f2d9fa4db43b10489173ddd9178db3eecfd7a2bae044"
        },
        {
          "url": "https://huggingface.co/BAAI/bge-base-zh-v1.5/resolve/f03589ceff5aac7111bd60cfc7d497ca17ecac65/sentence_bert_config.json",
          "relative_path": "sources/bge-base-zh-v1.5/sentence_bert_config.json",
          "size_bytes": 52,
          "sha256": "84e39fda68ccbff05bfa723ae9c0e70e23e2ec373b76e0f8c6e71af72a693cbf"
        },
        {
          "url": "https://huggingface.co/BAAI/bge-base-zh-v1.5/resolve/f03589ceff5aac7111bd60cfc7d497ca17ecac65/special_tokens_map.json",
          "relative_path": "sources/bge-base-zh-v1.5/special_tokens_map.json",
          "size_bytes": 125,
          "sha256": "b6d346be366a7d1d48332dbc9fdf3bf8960b5d879522b7799ddba59e76237ee3"
        },
        {
          "url": "https://huggingface.co/BAAI/bge-base-zh-v1.5/resolve/f03589ceff5aac7111bd60cfc7d497ca17ecac65/tokenizer.json",
          "relative_path": "sources/bge-base-zh-v1.5/tokenizer.json",
          "size_bytes": 439124,
          "sha256": "7dfbf1966ebf99d471c3796e9b457329d2b2182b817e144f1e904b957745c839"
        },
        {
          "url": "https://huggingface.co/BAAI/bge-base-zh-v1.5/resolve/f03589ceff5aac7111bd60cfc7d497ca17ecac65/tokenizer_config.json",
          "relative_path": "sources/bge-base-zh-v1.5/tokenizer_config.json",
          "size_bytes": 366,
          "sha256": "9261e7d79b44c8195c1cada2b453e55b00aeb81e907a6664974b4d7776172ab3"
        },
        {
          "url": "https://huggingface.co/BAAI/bge-base-zh-v1.5/resolve/f03589ceff5aac7111bd60cfc7d497ca17ecac65/vocab.txt",
          "relative_path": "sources/bge-base-zh-v1.5/vocab.txt",
          "size_bytes": 109540,
          "sha256": "45bbac6b341c319adc98a532532882e91a9cefc0329aa57bac9ae761c27b291c"
        }
      ],
      "artifact": {
        "relative_path": "models/bge-base-zh-v1.5-f16.gguf",
        "format": "gguf",
        "quantization": "F16",
        "expected_size_bytes": {
          "minimum": 204756128,
          "maximum": 204756128
        },
        "sha256": "677d0074629b28c96860d258d04c5197996d3f422cba84badadd64090e085f35",